{
  "$schema": "https://json-schema.org/draft/2020-12/schema",
  "additionalProperties": false,
  "properties": {
    "added_nodes": {
      "items": {
        "$ref": "#/$defs/planNode"
      },
      "type": "array"
    },
    "authority_delta": {
      "additionalProperties": false,
      "properties": {
        "connectors": {
          "items": {
            "$ref": "#/$defs/connectorAuthority"
          },
          "type": "array"
        },
        "model_context": {
          "$ref": "#/$defs/modelContext"
        },
        "mutations": {
          "items": {
            "type": "string"
          },
          "type": "array"
        }
      },
      "required": [
        "connectors",
        "mutations"
      ],
      "type": "object"
    },
    "budget_delta": {
      "additionalProperties": false,
      "properties": {
        "bytes": {
          "type": "integer"
        },
        "cost_units": {
          "type": "integer"
        },
        "human_reviews": {
          "type": "integer"
        },
        "model_tokens": {
          "type": "integer"
        },
        "source_calls": {
          "type": "integer"
        }
      },
      "required": [
        "bytes",
        "cost_units",
        "human_reviews",
        "model_tokens",
        "source_calls"
      ],
      "type": "object"
    },
    "compiler_rule": {
      "type": "string"
    },
    "retired_node_ids": {
      "items": {
        "type": "string"
      },
      "type": "array"
    },
    "schema": {
      "const": "plan_patch.v0"
    },
    "triggering_artifact": {
      "pattern": "^artifact:blake3:[0-9a-f]{64}$",
      "type": "string"
    }
  },
  "required": [
    "added_nodes",
    "authority_delta",
    "budget_delta",
    "compiler_rule",
    "retired_node_ids",
    "schema",
    "triggering_artifact"
  ],
  "type": "object",
  "$defs": {
    "artifactRef": {
      "pattern": "^artifact:blake3:[0-9a-f]{64}$",
      "type": "string"
    },
    "blake3": {
      "pattern": "^blake3:[0-9a-f]{64}$",
      "type": "string"
    },
    "budget": {
      "additionalProperties": false,
      "properties": {
        "bytes": {
          "minimum": 0,
          "type": "integer"
        },
        "cost_units": {
          "minimum": 0,
          "type": "integer"
        },
        "human_reviews": {
          "minimum": 0,
          "type": "integer"
        },
        "model_tokens": {
          "minimum": 0,
          "type": "integer"
        },
        "source_calls": {
          "minimum": 0,
          "type": "integer"
        }
      },
      "required": [
        "bytes",
        "cost_units",
        "human_reviews",
        "model_tokens",
        "source_calls"
      ],
      "type": "object"
    },
    "cachePolicy": {
      "additionalProperties": false,
      "properties": {
        "mode": {
          "enum": [
            "no_reuse",
            "reuse_allowed"
          ]
        }
      },
      "required": [
        "mode"
      ],
      "type": "object"
    },
    "connectorAuthority": {
      "additionalProperties": false,
      "properties": {
        "operations": {
          "items": {
            "type": "string"
          },
          "type": "array"
        },
        "provider": {
          "type": "string"
        }
      },
      "required": [
        "operations",
        "provider"
      ],
      "type": "object"
    },
    "consequenceAction": {
      "enum": [
        "abort_plan",
        "mark_unknown"
      ]
    },
    "modelContext": {
      "const": "metadata_only"
    },
    "nodeAuthority": {
      "additionalProperties": false,
      "properties": {
        "budget": {
          "$ref": "#/$defs/budget"
        },
        "connectors": {
          "items": {
            "$ref": "#/$defs/connectorAuthority"
          },
          "type": "array"
        },
        "model_context": {
          "$ref": "#/$defs/modelContext"
        },
        "mutations": {
          "items": {
            "type": "string"
          },
          "type": "array"
        }
      },
      "required": [
        "budget",
        "connectors",
        "model_context",
        "mutations"
      ],
      "type": "object"
    },
    "nodeConsequence": {
      "additionalProperties": false,
      "properties": {
        "on_cancel": {
          "$ref": "#/$defs/consequenceAction"
        },
        "on_empty": {
          "$ref": "#/$defs/consequenceAction"
        },
        "on_error": {
          "$ref": "#/$defs/consequenceAction"
        },
        "on_refusal": {
          "$ref": "#/$defs/consequenceAction"
        }
      },
      "required": [
        "on_cancel",
        "on_empty",
        "on_error",
        "on_refusal"
      ],
      "type": "object"
    },
    "nodeParams": {
      "oneOf": [
        {
          "additionalProperties": false,
          "properties": {
            "kind": {
              "const": "warehouse_read"
            },
            "read_spec": {
              "$ref": "#/$defs/warehouseReadSpec"
            }
          },
          "required": [
            "kind",
            "read_spec"
          ],
          "type": "object"
        },
        {
          "additionalProperties": false,
          "properties": {
            "kind": {
              "const": "operator"
            },
            "parameters": {
              "items": {
                "$ref": "#/$defs/parameter"
              },
              "type": "array"
            }
          },
          "required": [
            "kind",
            "parameters"
          ],
          "type": "object"
        }
      ]
    },
    "normalizationRule": {
      "additionalProperties": false,
      "properties": {
        "column": {
          "type": "string"
        },
        "placeholder_values": {
          "items": {
            "type": "string"
          },
          "type": "array"
        },
        "to": {
          "const": "null"
        }
      },
      "required": [
        "column",
        "placeholder_values",
        "to"
      ],
      "type": "object"
    },
    "operatorRef": {
      "additionalProperties": false,
      "properties": {
        "digest": {
          "$ref": "#/$defs/blake3"
        },
        "id": {
          "type": "string"
        },
        "version": {
          "type": "string"
        }
      },
      "required": [
        "digest",
        "id",
        "version"
      ],
      "type": "object"
    },
    "parameter": {
      "additionalProperties": false,
      "properties": {
        "name": {
          "type": "string"
        },
        "value": {
          "$ref": "#/$defs/scalarValue"
        }
      },
      "required": [
        "name",
        "value"
      ],
      "type": "object"
    },
    "planNode": {
      "additionalProperties": false,
      "properties": {
        "authority": {
          "$ref": "#/$defs/nodeAuthority"
        },
        "cache": {
          "$ref": "#/$defs/cachePolicy"
        },
        "completion": {
          "type": "string"
        },
        "consequence": {
          "$ref": "#/$defs/nodeConsequence"
        },
        "covers": {
          "items": {
            "type": "string"
          },
          "type": "array"
        },
        "idempotency_key": {
          "$ref": "#/$defs/blake3"
        },
        "inputs": {
          "items": {
            "$ref": "#/$defs/artifactRef"
          },
          "type": "array"
        },
        "node_id": {
          "type": "string"
        },
        "obligation": {
          "type": "string"
        },
        "operator": {
          "$ref": "#/$defs/operatorRef"
        },
        "params": {
          "$ref": "#/$defs/nodeParams"
        },
        "retry": {
          "$ref": "#/$defs/retryPolicy"
        },
        "timeout_seconds": {
          "minimum": 0,
          "type": "integer"
        }
      },
      "required": [
        "authority",
        "cache",
        "completion",
        "consequence",
        "covers",
        "idempotency_key",
        "inputs",
        "node_id",
        "obligation",
        "operator",
        "params",
        "retry",
        "timeout_seconds"
      ],
      "type": "object"
    },
    "readOrdering": {
      "additionalProperties": false,
      "properties": {
        "column": {
          "type": "string"
        },
        "direction": {
          "enum": [
            "asc",
            "desc"
          ]
        }
      },
      "required": [
        "column",
        "direction"
      ],
      "type": "object"
    },
    "readPredicate": {
      "additionalProperties": false,
      "properties": {
        "column": {
          "type": "string"
        },
        "op": {
          "enum": [
            "eq",
            "gte",
            "lte"
          ]
        },
        "value": {
          "$ref": "#/$defs/scalarValue"
        }
      },
      "required": [
        "column",
        "op",
        "value"
      ],
      "type": "object"
    },
    "retryPolicy": {
      "additionalProperties": false,
      "properties": {
        "max_attempts": {
          "minimum": 0,
          "type": "integer"
        }
      },
      "required": [
        "max_attempts"
      ],
      "type": "object"
    },
    "scalarValue": {
      "oneOf": [
        {
          "type": "boolean"
        },
        {
          "type": "integer"
        },
        {
          "type": "string"
        },
        {
          "type": "null"
        }
      ]
    },
    "warehouseReadSpec": {
      "additionalProperties": false,
      "properties": {
        "catalog_key": {
          "type": "string"
        },
        "columns": {
          "items": {
            "type": "string"
          },
          "type": "array"
        },
        "distinct": {
          "type": "boolean"
        },
        "normalization": {
          "items": {
            "$ref": "#/$defs/normalizationRule"
          },
          "type": "array"
        },
        "ordering": {
          "items": {
            "$ref": "#/$defs/readOrdering"
          },
          "type": "array"
        },
        "predicates": {
          "items": {
            "$ref": "#/$defs/readPredicate"
          },
          "type": "array"
        },
        "row_bound": {
          "minimum": 1,
          "type": "integer"
        }
      },
      "required": [
        "catalog_key",
        "columns",
        "distinct",
        "normalization",
        "ordering",
        "predicates",
        "row_bound"
      ],
      "type": "object"
    }
  }
}
