{"added_nodes":[{"authority":{"budget":{"bytes":0,"cost_units":5,"human_reviews":0,"model_tokens":0,"source_calls":1},"connectors":[{"operations":["read"],"provider":"openfigi"}],"model_context":"metadata_only","mutations":[]},"cache":{"mode":"reuse_allowed"},"completion":"anchor_resolution_artifact","consequence":{"on_cancel":"abort_plan","on_empty":"mark_unknown","on_error":"mark_unknown","on_refusal":"abort_plan"},"covers":["identifier_family:openfigi"],"idempotency_key":"blake3:7777777777777777777777777777777777777777777777777777777777777777","inputs":["artifact:blake3:aaaaaaaaaaaaaaaaaaaaaaaaaaaaaaaaaaaaaaaaaaaaaaaaaaaaaaaaaaaaaaaa"],"node_id":"openfigi.anchor_resolution","obligation":"resolve_openfigi_anchor_candidates","operator":{"digest":"blake3:8888888888888888888888888888888888888888888888888888888888888888","id":"openfigi_anchor_resolution","version":"0.1.0"},"params":{"kind":"operator","parameters":[{"name":"identifier_family","value":"openfigi"},{"name":"row_bound","value":10000}]},"retry":{"max_attempts":1},"timeout_seconds":300}],"authority_delta":{"connectors":[{"operations":["read"],"provider":"openfigi"}],"model_context":"metadata_only","mutations":[]},"budget_delta":{"bytes":0,"cost_units":5,"human_reviews":0,"model_tokens":0,"source_calls":1},"compiler_rule":"add_openfigi_anchor_after_materialized_warehouse_read","retired_node_ids":[],"schema":"plan_patch.v0","triggering_artifact":"artifact:blake3:aaaaaaaaaaaaaaaaaaaaaaaaaaaaaaaaaaaaaaaaaaaaaaaaaaaaaaaaaaaaaaaa"}
